{
  "schema_version": "1.12.0",
  "session_id": "11111111-1111-4111-8111-111111111111",
  "phase_inferred": "OVULATORY",
  "fatigue_level": "MEDIUM",
  "k_load_multiplier": 0.88,
  "autonomic_status": "PARASYMPATHETIC_WITHDRAWAL",
  "articular_risk_pct": 72,
  "contraindicated_patterns": ["plyometric"],
  "notes": ["High joint-risk window (ovulation)."],
  "source": "core"
}
